{
  "name": "right",
  "use": "apriltag",
  "column": 0,
  "pose": {
    "x": {
      "val": -0.33,
      "uom": "m"
    },
    "y": {
      "val": -0.33,
      "uom": "m"
    },
    "z": {
      "val": 0.5,
      "uom": "m"
    },
    "roll": {
      "val": 0,
      "uom": "deg"
    },
    "pitch": {
      "val": 0,
      "uom": "deg"
    },
    "rotation": {
      "val": -90,
      "uom": "deg"
    }
  }
}
