{
  "name": "shooter",
  "use": "target",
  "column": 0,
  "pose": {
    "x": {
      "val": 0.25,
      "uom": "m"
    },
    "y": {
      "val": 0,
      "uom": "m"
    },
    "z": {
      "val": 0.25,
      "uom": "m"
    },
    "roll": {
      "val": 0,
      "uom": "deg"
    },
    "pitch": {
      "val": 10,
      "uom": "deg"
    },
    "rotation": {
      "val": 0,
      "uom": "deg"
    }
  },
  "targetFiducialIds": [
    17,
    18,
    19,
    20,
    21,
    22
  ]
}
